{
  "$schema": "http://json-schema.org/draft-07/schema#",
  "type": "object",
  "properties": {
    "orderId": {
      "type": "string",
      "minLength": 1
    },
    "customer": {
      "type": "object",
      "properties": {
        "name": {
          "type": "string",
          "minLength": 1
        },
        "address": {
          "type": "string",
          "minLength": 1
        }
      },
      "required": ["name", "address"]
    },
    "content": {
      "type": "array",
      "items": {
        "type": "object",
        "properties": {
          "recipeId": {
            "type": "string",
            "minLength": 1
          },
          "pricePerUnity": {
            "type": "number",
            "multipleOf": 0.01,
            "minimum": 0
          },
          "quantity": {
            "type": "integer"
          }
        },
        "required": ["recipeId", "pricePerUnity", "quantity"]
      }
    },
    "totalPrice": {
      "type": "number",
      "multipleOf": 0.01,
      "minimum": 0
    }
  },
  "required": ["orderId", "customer", "content", "totalPrice"]
}
